{
  "question": "我们准备在大学一年级 C 语言课程中允许学生使用生成式 AI 编程助手。它到底会不会提高学习效果？应该怎样引入？",
  "decision_target": "teaching_decision",
  "learner": {
    "education_level": "undergraduate_year_1",
    "major": "computer_science",
    "prior_knowledge": "first_programming_course_no_prior_text_based_programming",
    "special_characteristics": "mixed_ability_large_class_60_students"
  },
  "course": {
    "subject": "C_programming",
    "course_type": "lecture_lab",
    "duration": "16_weeks_one_semester"
  },
  "intervention": {
    "teaching_method": "lecture_with_lab_exercises",
    "ai_tool": "generative_ai_coding_assistant",
    "allowed_usage": "under_design_pending_evidence_review",
    "frequency": "weekly_lab_sessions",
    "duration": "one_semester"
  },
  "comparison": "no_ai_coding_assistant_control",
  "outcomes": {
    "primary": ["independent_problem_solving", "code_quality"],
    "secondary": ["completion_time", "retention", "knowledge_gain"],
    "risk": ["ai_dependency", "over_reliance", "reduced_transfer"]
  },
  "context": {
    "teacher_support": "TA_supported_two_TAs",
    "class_size": "60_students",
    "online_or_offline": "offline"
  },
  "scope": {
    "time_range": "2021-2026",
    "geography": "worldwide",
    "study_types": ["rct", "quasi_experimental", "observational"]
  },
  "inclusion_criteria": [
    "studies_of_generative_AI_coding_tools_in_learning_to_program",
    "outcomes_measuring_learning_not_only_task_speed",
    "university_or_novice_programming_populations"
  ],
  "exclusion_criteria": [
    "practitioner_anecdotes_without_data",
    "industry_professional_populations_only"
  ],
  "success_condition": "independent problem solving and code quality improve (or do not decline) while AI dependency risk stays controlled; evidence base supports a bounded pilot."
}
